name,address,categories,category_ids,city,description,distance,foursquare_id,hours,instagram_url,is_nightlife,last_fsq_refresh,lat,lng,place_id,popularity,price_level,rating,social_media,state,summary,tips,types,website
Secret Island Tiki Restaurant and Lounge,"Underground below Shannon's on Pine, 209 Pine Ave, Long Beach, CA 90802, USA",Italian Restaurant,13236,Los Angeles,,109,4a1f5a25f964a520237c1fe3,"{'tuesday': '5:00\u2009–\u200911:00\u202fPM', 'monday': '5:00\u2009–\u200911:00\u202fPM', 'sunday': '2:00\u2009–\u200910:00\u202fPM', 'friday': '5:00\u202fPM\u2009–\u20091:30\u202fAM', 'saturday': '5:00\u202fPM\u2009–\u20091:30\u202fAM', 'wednesday': '5:00\u2009–\u200911:00\u202fPM', 'thursday': '5:00\u202fPM\u2009–\u200912:00\u202fAM'}",https://www.instagram.com/secretislandtiki/,False,2025-05-11 23:57:38.271381+00:00,33.76952180000001,-118.1927462,ChIJjbmbZ0ox3YAR7wjQUbXLxxc,,,4.2,{},CA,A Italian Restaurant in downtown LA.,"Amazing atmosphere. Very intimate. Beautiful decor. Delicious food. Definitely a ""must go to"" location for your food adventure | If you want to make interesting new friends and have a delicious meal, La Traviata has partnered with grubwithus.com to host a social dinner on the first Wednesday of every month. | Very nice ambiance.  Chilean Sea Bass is excellent!   Owner Mario is very hands on.  Would rate it a 10/10.","bar, point_of_interest, establishment",https://www.secretisland.shannonscorner.com/
The Speakeasy,"25 N Raymond Ave, Pasadena, CA 91103, USA","Speakeasy, Lounge","13016, 13021",Los Angeles,,708,4fa4a338e4b052ea291383f6,"{'tuesday': 'Closed', 'monday': 'Closed', 'sunday': 'Closed', 'friday': '7:00\u202fPM\u2009–\u20092:30\u202fAM', 'saturday': '7:00\u202fPM\u2009–\u20092:30\u202fAM', 'wednesday': 'Closed', 'thursday': '8:00\u202fPM\u2009–\u20091:00\u202fAM'}",http://instagram.com/thespeakeasy,False,2025-05-11 23:58:25.920486+00:00,34.14632340000001,-118.1490761,ChIJjfzzvnHDwoARFn1EkX_wgKU,,2,4.4,{},CA,"Dark cocktail lounge with a vintage 1920s vibe, featuring a hidden entrance & secret password.",Kenya was a great bartender. Made us excellent drinks and provided us with great service. I went on a Thursday so things were slower but still had a good time. The jalapeño tequila shot is delicious | This drink called the kiddy/kitty killer is beyond delicious. The vibe in here is worth checking out. | Drinks off the menu were decent. Asking for something so simple as an old fashioned was something left to be desired. The bartender knew nothing about the many whiskeys on the shelves.,"bar, point_of_interest, establishment",http://www.speakeasypasadena.com
Wirtshaus German Restaurant & Beer Garden,"345 N La Brea Ave, Los Angeles, CA 90036, USA","Gastropub, German Restaurant","13057, 13165",Los Angeles,,2024,4dd713a96365d68ffa7f7c23,"{'tuesday': '4:00\u2009–\u200910:30\u202fPM', 'monday': '4:00\u2009–\u200910:30\u202fPM', 'sunday': '11:00\u202fAM\u2009–\u200910:30\u202fPM', 'friday': '11:00\u202fAM\u2009–\u200911:30\u202fPM', 'saturday': '11:00\u202fAM\u2009–\u200911:30\u202fPM', 'wednesday': '4:00\u2009–\u200910:30\u202fPM', 'thursday': '4:00\u2009–\u200911:00\u202fPM'}",http://www.instagram.com/wirtshaus,False,2025-05-11 23:45:15.262177+00:00,34.0776568,-118.3442804,ChIJk-7Ya9a4woAR6Mb9zBXz7j4,,2,4.6,{},CA,Sausages & other German fare are available at this beer house with Ping-Pong & an outdoor patio.,"Wirtshaus is new, opened in 2011, but not too newfangled—this is a real German restaurant, run by real Germans, and the menu accordingly skews toward traditional German wurst. | Not terribly authentic, but definitely not bad! Great selection of German beer, plus they even have Spezi and Apfelschorle. I enjoyed my Jägerschnitzel, but the house Schnitzel looked really good too. | Cabbage is trending this week, and no one does it better. This joint also has a beer garden where you can enjoy the red cabbage with the Jaeger schnitzel, washed down with one of the German brews.","bar, restaurant, food, point_of_interest, establishment",http://www.wirtshausla.com/
Flora Rooftop Bar and Lounge,"2130 E Maple Ave, El Segundo, CA 90245, USA",Dining and Drinking,13000,Los Angeles,,1640,5dabadc13aecc100087c52ba,"{'tuesday': '4:00\u2009–\u20099:00\u202fPM', 'monday': '4:00\u2009–\u200910:00\u202fPM', 'sunday': '4:00\u2009–\u200910:00\u202fPM', 'friday': '4:00\u2009–\u200910:00\u202fPM', 'saturday': '4:00\u2009–\u200910:00\u202fPM', 'wednesday': '4:00\u2009–\u200910:00\u202fPM', 'thursday': '4:00\u2009–\u200910:00\u202fPM'}",https://www.instagram.com/florarooftop/,False,2025-05-11 23:56:00.494366+00:00,33.9266698,-118.3863664,ChIJk_xk4Ha3woARi52v2Jeir4U,,,4.4,{},CA,A Dining and Drinking in downtown LA.,,"bar, night_club, restaurant, food, point_of_interest, establishment",http://www.florarooftop.com/
Station1640,"1640 N Cahuenga Blvd, Los Angeles, CA 90028, USA","Night Club, Bar, Restaurant","10032, 13065, 13003",Los Angeles,,0,5a484f549deb7d743060489a,"{'tuesday': 'Closed', 'monday': '9:00\u202fPM\u2009–\u20092:00\u202fAM', 'sunday': '3:00\u202fPM\u2009–\u20092:00\u202fAM', 'friday': '9:00\u202fPM\u2009–\u20092:00\u202fAM', 'saturday': '3:00\u202fPM\u2009–\u20092:00\u202fAM', 'wednesday': '9:00\u202fPM\u2009–\u20092:00\u202fAM', 'thursday': '9:00\u202fPM\u2009–\u20092:00\u202fAM'}",https://www.instagram.com/junglehollywood/,False,,34.1010585,-118.3293133,ChIJkbC92ju_woAR6nXPMGm8wBA,,2,3.7,{},CA,"Modern nightspot with colorful decor offering DJ'd music, dancing & karaoke nights.",Great for karaoke,"night_club, restaurant, food, point_of_interest, establishment",https://www.junglehollywood.com/
Magic Wheels Motorcycle Club,"13125 S Broadway, Los Angeles, CA 90061, USA",Industrial Equipment Supplier,11105,Los Angeles,,1638,7f093abf827543a9e0ca6fae,,,False,2025-05-11 23:56:41.013784+00:00,33.9125044,-118.2788041,ChIJkwPM0r3LwoARnjtIauXXfyQ,,,4.8,{},CA,A Industrial Equipment Supplier in downtown LA.,,"bar, point_of_interest, establishment",
Monty Bar,"1222 W 7th St, Los Angeles, CA 90017, USA","Night Club, Cocktail Bar, Lounge","10032, 13009, 13016",Los Angeles,,2270,4e0ec9211f6e9964ea26babc,"{'tuesday': '8:00\u202fPM\u2009–\u20092:00\u202fAM', 'monday': '8:00\u202fPM\u2009–\u20092:00\u202fAM', 'sunday': '8:00\u202fPM\u2009–\u20092:00\u202fAM', 'friday': '5:00\u202fPM\u2009–\u20092:00\u202fAM', 'saturday': '8:00\u202fPM\u2009–\u20092:00\u202fAM', 'wednesday': '8:00\u202fPM\u2009–\u20092:00\u202fAM', 'thursday': '5:00\u202fPM\u2009–\u20092:00\u202fAM'}",,False,2025-05-11 23:49:52.772187+00:00,34.0516034,-118.2667803,ChIJkwZR0rrHwoARNK40kUjCEfo,,2,4.3,{},CA,"Handsome destination for craft beer served in refined, dark-wood-heavy, vintage surrounds, plus DJs.","Fun divebar. Cool djs mixed throwback jazz and soul and electro late into the night. $6 drafts, good service and a cool union station vibe with decor to match. | Nice atmosphere, the wood, dark accents and animal heads on the wall give it some flavor. If there's a show next door then chances are it will be busy after it gets out. | Love the vibe.  Alternative scene with locals.  Good music and historic venue.  Though I know nothing about the history like all the other millennials here.","bar, point_of_interest, establishment",http://www.montybar.com/
Good Times at Davey Wayne's,"1611 N El Centro Ave, Los Angeles, CA 90028, USA","Cocktail Bar, Lounge, American Restaurant","13016, 13009, 13068",Los Angeles,,0,5345f2b6498e374167fc5d7a,"{'tuesday': '8:00\u202fPM\u2009–\u20092:00\u202fAM', 'monday': '8:00\u202fPM\u2009–\u20092:00\u202fAM', 'sunday': '2:00\u202fPM\u2009–\u20092:00\u202fAM', 'friday': '8:00\u202fPM\u2009–\u20092:00\u202fAM', 'saturday': '2:00\u202fPM\u2009–\u20092:00\u202fAM', 'wednesday': '8:00\u202fPM\u2009–\u20092:00\u202fAM', 'thursday': '8:00\u202fPM\u2009–\u20092:00\u202fAM'}",,False,,34.1002939,-118.323979,ChIJl9fwEzi_woARA9c1iEzQS4s,,2,4.3,{},CA,"Funky '70s retro bar with era-appropriate garage sale decor, an Airstream trailer & backyard BBQ.","Pretty f!cking great. If you were to walk in on acid you'd probably convince yourself that it was actually 1976. Expect it to be packed. Best for day drinking on the weekends when they open at 2. | It's the little touches that you'll love with this spot. Funky soul and classic rock blare in the background, and sometimes rollerskaters come out for performances.Make sure to try a pork belly sammie | I really love how casual and relaxed this place is, especially for Hollywood. The snow cones are good (though low alcohol). I got the blackberry ginger bourbon one.","bar, point_of_interest, establishment",http://goodtimesatdaveywaynes.com/
Bar Stella,"3930 W Sunset Blvd, Los Angeles, CA 90029, USA",Cocktail Bar,13009,Los Angeles,,181,5028193be4b0c8045373f1b7,"{'tuesday': '5:00\u202fPM\u2009–\u200912:00\u202fAM', 'monday': '5:00\u202fPM\u2009–\u200912:00\u202fAM', 'sunday': '5:00\u202fPM\u2009–\u200912:00\u202fAM', 'friday': '5:00\u202fPM\u2009–\u20092:00\u202fAM', 'saturday': '5:00\u202fPM\u2009–\u20092:00\u202fAM', 'wednesday': '5:00\u202fPM\u2009–\u20092:00\u202fAM', 'thursday': '5:00\u202fPM\u2009–\u20092:00\u202fAM'}",https://www.instagram.com/cafestella/,False,2025-05-11 23:53:39.406217+00:00,34.0921408,-118.2804081,ChIJlQFcw73HwoARplQy4rm_p8k,,,3.9,{},CA,A Cocktail Bar in downtown LA.,"Amazing bar. Seasonal cocktails are outstanding, but you can't go wrong with the classics either. Plus the atmosphere is romantic, not too loud -- this is where you bring a date you want to impress. | Fantastic French restaurant. The escargots were perfect and so was the steak frites. The ambiance is spot on too. | Love the interior. Cute outside small patio section. They have a cucumber jalapeño drink that was really spicy and really good.","bar, point_of_interest, establishment",https://cafestella.com/barstella
No Vacancy,"1727 N Hudson Ave, Los Angeles, CA 90028, USA","Cocktail Bar, Lounge, Speakeasy","13016, 13009, 13021",Los Angeles,,0,509a18d8e4b08bf010b68112,"{'tuesday': 'Closed', 'monday': 'Closed', 'sunday': 'Closed', 'friday': '8:00\u202fPM\u2009–\u20092:00\u202fAM', 'saturday': '8:00\u202fPM\u2009–\u20092:00\u202fAM', 'wednesday': 'Closed', 'thursday': '8:00\u202fPM\u2009–\u20092:00\u202fAM'}",https://instagram.com/novacancyla,False,2025-05-12 00:45:07.051112+00:00,34.1022632,-118.3325205,ChIJlU0Ogzy_woARU50hhruvVYs,,2,4.2,{},CA,"Swanky, shadowy bar mixes sophisticated cocktails amid decor recalling the bygone days of Hollywood.","The biggest good surprise I experienced. Unique entrance, nice mood, good cocktails (strong) and definitely good crowd. Come to have a chat, forget your phone. Good live music and DJ too. Always nice! | Like a fancy backyard soiree with a dark, mysterious vibe. Loved the surprise entrance, and the beautiful outdoor space, complete with a greenhouse-like bar and fireplaces. Can't wait to return! | This place is crazy town USA. The sliding bed entrance alone is worth the visit and the atmosphere is great! A few dopey white boys here and there talking about money cap but ignore them and have fun!","bar, point_of_interest, establishment",http://www.novacancyla.com/
The Room Santa Monica,"1325 Santa Monica Blvd, Santa Monica, CA 90404, USA","Cocktail Bar, Lounge, Restaurant","13016, 13009, 13065",Los Angeles,,0,ecc1fc4cbfa9406b7dd32a18,"{'tuesday': '9:00\u202fPM\u2009–\u20091:00\u202fAM', 'monday': 'Closed', 'sunday': '7:00\u202fPM\u2009–\u200912:00\u202fAM', 'friday': '9:00\u202fPM\u2009–\u20092:00\u202fAM', 'saturday': '9:00\u202fPM\u2009–\u20092:00\u202fAM', 'wednesday': 'Closed', 'thursday': '9:00\u202fPM\u2009–\u20092:00\u202fAM'}",http://instagram.com/theroomsantamonica,False,2025-05-12 00:41:27.653820+00:00,34.024002,-118.486164,ChIJlWoctjS7woARE2BY-SoHors,,2,4,{},CA,Mixologists whip up craft cocktails at this luxe nightspot with leather couches & a moody vibe.,,"bar, point_of_interest, establishment",http://www.circa93.com/the-room-santa-monica/
Observation Bar,"1126 Queens Hwy, Long Beach, CA 90802, USA","Cocktail Bar, Lounge","13016, 13009",Los Angeles,,1900,4af76279f964a520ee0822e3,"{'tuesday': '4:00\u2009–\u200910:30\u202fPM', 'monday': '4:00\u2009–\u200910:30\u202fPM', 'sunday': '11:00\u202fAM\u2009–\u200910:30\u202fPM', 'friday': '11:00\u202fAM\u2009–\u200910:30\u202fPM', 'saturday': '11:00\u202fAM\u2009–\u200910:30\u202fPM', 'wednesday': '4:00\u2009–\u200910:30\u202fPM', 'thursday': '4:00\u2009–\u200910:30\u202fPM'}",https://www.instagram.com/thequeenmary/,False,2025-05-11 23:57:13.830247+00:00,33.7531971,-118.1906406,ChIJlWtAnNgw3YARCO5uDZXYNRU,,2,4.5,{},CA,"Housed on the historic Queen Mary, this classy cocktail lounge with live music has a 1930s-era vibe.","This place was amazing beautiful looking. The bar is made out of actual wood that makes it look like a barrow. | Touring Queen Mary is thirsty work, so it was time to hit the bar for a refresher. Having a blast! | Lovely decorated bar with an amazing view of downtown Long Beach. There is an outside patio.","bar, point_of_interest, establishment",https://www.queenmary.com/observation-bar/
Maya Hookah Lounge,"700 Queensway Dr, Long Beach, CA 90802, USA","Hookah Bar, Latin American Restaurant","13297, 13012",Los Angeles,,1518,4e98d5cfbe7b1a0d648ef814,"{'tuesday': 'Closed', 'monday': 'Closed', 'sunday': '5:00\u202fPM\u2009–\u200912:00\u202fAM', 'friday': '5:00\u202fPM\u2009–\u20091:30\u202fAM', 'saturday': '5:00\u202fPM\u2009–\u20091:30\u202fAM', 'wednesday': 'Closed', 'thursday': '5:00\u202fPM\u2009–\u200912:00\u202fAM'}",http://instagram.com/socalhookahs,False,2025-05-11 23:57:11.987020+00:00,33.757081,-118.1986444,ChIJlwjpvy4x3YARz0FwSwHOx80,,,4,{},CA,A Hookah Bar and Latin American Restaurant in downtown LA.,"Great ambiance, only hookah lounge with water front view, there is no loud music and you gonna be able to talk to the person next to.. you.. | Hookah, drinks and amazing ocean view | Open Thursday through Sunday 7pm-1am for more information and reservation call 714-306-0455","bar, point_of_interest, establishment",http://www.socalhookahs.com/
SoopSok Karaoke,"4070 W 3rd St, Los Angeles, CA 90020, USA","Karaoke Box, Restaurant","13065, 10021",Los Angeles,,0,d49a457fac1647f43d331aa8,"{'tuesday': '6:00\u202fPM\u2009–\u20092:00\u202fAM', 'monday': '6:00\u202fPM\u2009–\u20092:00\u202fAM', 'sunday': '6:00\u202fPM\u2009–\u20092:00\u202fAM', 'friday': '6:00\u202fPM\u2009–\u20092:00\u202fAM', 'saturday': '6:00\u202fPM\u2009–\u20092:00\u202fAM', 'wednesday': '6:00\u202fPM\u2009–\u20092:00\u202fAM', 'thursday': '6:00\u202fPM\u2009–\u20092:00\u202fAM'}",,False,2025-05-12 00:56:22.792524+00:00,34.0688231,-118.3025027,ChIJm0XrgJ64woAR4VOrMjqQCU0,,2,3.7,{},CA,"Karaoke in 4 languages plus plasma screens, surround sound, drinks & eats in a choice of 20 rooms.",,"night_club, bar, point_of_interest, establishment",http://www.soopsokkaraoke.net/
Blitzen's Bar,"10250 Santa Monica Blvd, Los Angeles, CA 90067, USA","Beer Bar, Sushi Restaurant","13276, 13006",Los Angeles,,2750,5e11191022d7dd0008a3a5c7,,,False,2025-05-12 00:00:58.724990+00:00,34.05809660000001,-118.4183374,ChIJm7HyIgC7woARDQA0n5gV55I,,,2.5,{},CA,A Beer Bar and Sushi Restaurant in downtown LA.,"Signature Handroll is out of this world. Also had the lobster, yellowtail, bay scallop, and salmon. Not disappointed by any of it! Definitely recommend if you’re looking for quick, high quality, sushi | Hand roll serving has changed since the pandemic. Before it was similar to Kazu Nori, now they prepare the hand rolls in the kitchen and the nori doesn’t have the same crunch. | The blue crab hand roll is the best roll they offer, but you might be better off going elsewhere for a sushi fix.","bar, point_of_interest, establishment",https://www.westfield.com/en/united-states/centurycity/restaurants/blitzen-s-bar/81488
Roches Bar,"8500 Beverly Blvd, Los Angeles, CA 90048, USA",Gym and Studio,18021,Los Angeles,,2218,5f5d2e81a367427a34102d4d,"{'tuesday': '12:30\u2009–\u20099:00\u202fPM', 'monday': '12:30\u2009–\u20099:00\u202fPM', 'sunday': '12:30\u2009–\u20099:00\u202fPM', 'friday': '12:30\u2009–\u20099:00\u202fPM', 'saturday': '12:30\u2009–\u20099:00\u202fPM', 'wednesday': '12:30\u2009–\u20099:00\u202fPM', 'thursday': '12:30\u2009–\u20099:00\u202fPM'}",,False,2025-05-11 23:45:36.944305+00:00,34.0753309,-118.3774933,ChIJm80NzUy5woARqoBe02KEtjs,,,,{},CA,A Gym and Studio in downtown LA.,,"bar, restaurant, food, point_of_interest, establishment",http://www.rochesbar.ie/contact/
Brewster's Bar & Grill,"9750 Airport Blvd, Los Angeles, CA 90045, USA","Hotel Bar, American Restaurant","13068, 13013",Los Angeles,,2592,4af4e0c5f964a5202ef721e3,"{'tuesday': '4:00\u2009–\u200911:00\u202fPM', 'monday': '4:00\u2009–\u200911:00\u202fPM', 'sunday': '4:00\u2009–\u20097:00\u202fPM', 'friday': '4:00\u202fPM\u2009–\u200912:00\u202fAM', 'saturday': '12:00\u202fPM\u2009–\u200912:00\u202fAM', 'wednesday': '4:00\u2009–\u200911:00\u202fPM', 'thursday': '4:00\u202fPM\u2009–\u200912:00\u202fAM'}",,False,2025-05-11 23:56:16.680434+00:00,33.9478744,-118.3851393,ChIJm9n48Na2woARXxitLRv7Hio,,,3.9,{},CA,Spacious hotel bar/grill boasting 16 flat-screen TVs & 100+ domestic & imported beers.,"Huge beer selection, free biscuits, sports showing on flat screens,  nice staff and good food! I had the Pastrami Club. Layers and layers of flavorful  pastrami! Worth the visit if staying overnight. | To label this is a 'breakfast spot' is underselling all the awesomeness that is this bar.With 100+ beers both on tap/in bottle,this is a beer lovers heaven.I wish I never had to leave. | My husband and I came here for a 2 day layover on our way to our honeymoon destination and they brought us complimentary champagne and a photo frame with a card signed by the entire staff. Special :)","bar, restaurant, food, point_of_interest, establishment",https://www.marriott.com/hotels/hotel-information/restaurant/laxfp-four-points-los-angeles-international-airport/
Congregation Brewery & Cocina - Pasadena,"300 S Raymond Ave, Pasadena, CA 91105, USA",Animal Shelter,12002,Los Angeles,,136,4b6b3f55f964a520f3fb2be3,"{'tuesday': '11:00\u202fAM\u2009–\u200910:00\u202fPM', 'monday': '11:00\u202fAM\u2009–\u200910:00\u202fPM', 'sunday': '8:00\u202fAM\u2009–\u200910:00\u202fPM', 'friday': '11:00\u202fAM\u2009–\u20092:00\u202fAM', 'saturday': '8:00\u202fAM\u2009–\u20092:00\u202fAM', 'wednesday': '11:00\u202fAM\u2009–\u200910:00\u202fPM', 'thursday': '11:00\u202fAM\u2009–\u200912:00\u202fAM'}",https://www.instagram.com/congregationbc/,False,2025-05-11 23:58:05.121541+00:00,34.1401049,-118.1485221,ChIJmSpl3XrDwoARMgP4XwCDjpI,,2,4.3,{},CA,Spacious outpost with a large beer selection serving American grill grub in a cathedral-like space.,"PHS will close at 3:30pm on Thanksgiving Eve and will be closed on Thanksgiving Day. Not to worry, we'll be open again on Friday! | You don't have to be a volunteer to help the animals.  There is a pet store on site and all the proceeds benefit the animals at the shelter. :) | Our Pet Store is your one-stop holiday shop for your pet. We've got everything from cozy sweaters to holiday-themed toys and collars. Check it out!","bar, restaurant, food, point_of_interest, establishment",https://congregationbreweryandcocina.com/
The Little Bar,"757 S S La Brea Ave, Los Angeles, CA 90036, USA","Lounge, Dive Bar","13016, 13010",Los Angeles,,1251,4341c600f964a52057281fe3,"{'tuesday': '5:00\u202fPM\u2009–\u20092:00\u202fAM', 'monday': 'Closed', 'sunday': '1:00\u202fPM\u2009–\u20091:00\u202fAM', 'friday': '5:00\u202fPM\u2009–\u20092:00\u202fAM', 'saturday': '2:00\u202fPM\u2009–\u20092:00\u202fAM', 'wednesday': '5:00\u202fPM\u2009–\u20092:00\u202fAM', 'thursday': '5:00\u202fPM\u2009–\u20092:00\u202fAM'}",,False,2025-05-11 23:45:30.524705+00:00,34.0607152,-118.3449341,ChIJmerWLeC4woAR_oRzvxGr3TQ,,1,4.3,{},CA,Festive local tavern with many tap beers & craft cocktails in a funky space with a jukebox & darts.,"Little Bar is a neighborhood bar with character & cool regulars. Now that their license is upgraded from beer & Soju to full bar, the energy has gone way-up. Monday karaoke attracts real  talent. | Local spot that’s not pretentious with reasonable prices. Super friendly staff with good booze options. No food but they let you order in from Uber eats or anything you like, pretty cool. | The place was dark which i like and taste of my Chimay was very nice ;) Even i dropped the first one little bit, the bartender filled it out for free ;)","bar, night_club, point_of_interest, establishment",http://www.littlebarlounge.com/
W XYZ bar,"475 CA-1, El Segundo, CA 90245, USA","Cocktail Bar, Hotel Bar, Restaurant","13009, 13013, 13065",Los Angeles,,1128,571aaffb498e8b42afbaf83c,"{'tuesday': '5:00\u2009–\u200910:00\u202fPM', 'monday': '5:00\u2009–\u200910:00\u202fPM', 'sunday': '5:00\u2009–\u200910:00\u202fPM', 'friday': '5:00\u202fPM\u2009–\u200912:00\u202fAM', 'saturday': '5:00\u202fPM\u2009–\u200912:00\u202fAM', 'wednesday': '5:00\u2009–\u200910:00\u202fPM', 'thursday': '5:00\u2009–\u200910:00\u202fPM'}",,False,2025-05-11 23:55:38.515056+00:00,33.9219444,-118.3966667,ChIJmfh7iEuxwoARbtXM2aMDMrg,,2,4.4,{},CA,"Bright, chill bar inside the Aloft Hotel for pints, pinots & cocktails plus an ample snack menu.","Ask for Nicole, AJ or Heather! They are awesome!","bar, point_of_interest, establishment",https://www.marriott.com/hotels/travel/laxla-aloft-el-segundo-los-angeles-airport/
Birdcage Coffee House,"224 W 4th St, Long Beach, CA 90802, USA","Burger Joint, Coffee Shop, American Restaurant","13035, 13068, 13031",Los Angeles,,176,4b7cb815f964a520d5a22fe3,"{'tuesday': '7:00\u202fAM\u2009–\u20094:00\u202fPM', 'monday': 'Closed', 'sunday': '7:00\u202fAM\u2009–\u20094:00\u202fPM', 'friday': '7:00\u202fAM\u2009–\u20094:00\u202fPM', 'saturday': '7:00\u202fAM\u2009–\u20094:00\u202fPM', 'wednesday': '7:00\u202fAM\u2009–\u20094:00\u202fPM', 'thursday': '7:00\u202fAM\u2009–\u20094:00\u202fPM'}",,False,2025-05-11 23:57:31.750082+00:00,33.7715353,-118.1945263,ChIJn-gk9zcx3YARempjTL9_4Fs,,1,4.6,{},CA,"Vintage-chic coffee shop featuring espresso & snacks, plus Wi-Fi & a leafy patio.",Tuna or Turkey Croissant-which and Mexican Mocha! They have almond and soy milk! Mmm | The owner is super friendly and makes us the best coffee drinks! | Spot on cappuccino! Just be sure to bring some cash.,"cafe, bar, store, restaurant, food, point_of_interest, establishment",
Melody Bar & Grill,"9132 S Sepulveda Blvd, Los Angeles, CA 90045, USA","Lounge, Sports Bar, New American Restaurant","13016, 13314, 13022",Los Angeles,,2701,4a7a5d05f964a5203de91fe3,"{'tuesday': '11:00\u202fAM\u2009–\u20091:30\u202fAM', 'monday': '11:00\u202fAM\u2009–\u20091:00\u202fAM', 'sunday': '9:00\u202fAM\u2009–\u20091:00\u202fAM', 'friday': '11:00\u202fAM\u2009–\u20091:30\u202fAM', 'saturday': '9:00\u202fAM\u2009–\u20091:30\u202fAM', 'wednesday': '11:00\u202fAM\u2009–\u20091:00\u202fAM', 'thursday': '11:00\u202fAM\u2009–\u20091:00\u202fAM'}",https://www.instagram.com/melodylax/,False,2025-05-11 23:55:04.695542+00:00,33.9537441,-118.3959086,ChIJn9dwd9OwwoARJSS_JjeTStM,,2,4.3,{},CA,"Veteran eatery & watering hole offering pub grub, live music, pool & games in a comfy, woody space.","Cool place🍺 Has very good food for a bar👍. Lots of games & pool🎱. Very cool owner! Plenty of parking in the back🚘 & you can watch the planes come in low, above head- landing @ LAX✈ ""Hi Lillian!💘"" | Anything with King's Hawaiian Rolls are great. Which makes these sliders great on top of the fact the the meat is well seasoned. | The jalapeno calamari is awesome. Perfectly fried pieces of calamari with fried jalapeños to kick the heat up a notch.","bar, restaurant, food, point_of_interest, establishment",http://www.melodylax.com/
Founders Ale House,"8771 W Pico Blvd, Los Angeles, CA 90035, USA","Sports Bar, Gastropub, New American Restaurant","13057, 13314, 13022",Los Angeles,,2503,584de7af5a5869668fd19293,"{'tuesday': '4:00\u202fPM\u2009–\u200912:00\u202fAM', 'monday': '4:00\u2009–\u200911:00\u202fPM', 'sunday': '12:30\u202fPM\u2009–\u200912:00\u202fAM', 'friday': '3:00\u202fPM\u2009–\u20091:00\u202fAM', 'saturday': '9:00\u202fAM\u2009–\u20091:00\u202fAM', 'wednesday': '4:00\u202fPM\u2009–\u200912:00\u202fAM', 'thursday': '4:00\u202fPM\u2009–\u200912:00\u202fAM'}",http://www.instagram.com/foundersalehouse,False,2025-05-11 23:45:44.497936+00:00,34.054926,-118.383229,ChIJnYQZE125woARdmqMJ-a0sno,,2,4.4,{},CA,"Rotating craft beers & American comfort fare, including vegan bites, in a laid-back sports pub.",Best draft beer selection in the area! | Good draft selection.  Way to many TVs | great neighborhood sports bar in Pico Robertson!,"bar, restaurant, food, point_of_interest, establishment",http://www.foundersalehouse.com/
