name,address,categories,category_ids,city,description,distance,foursquare_id,hours,instagram_url,is_nightlife,last_fsq_refresh,lat,lng,place_id,popularity,price_level,rating,social_media,state,summary,tips,types,website
Tony's Saloon,"2017 E 7th St, Los Angeles, CA 90021, USA",Whisky Bar,13024,Los Angeles,,1698,4a15b070f964a520b9781fe3,"{'tuesday': '4:00\u202fPM\u2009–\u20092:00\u202fAM', 'monday': '4:00\u202fPM\u2009–\u20092:00\u202fAM', 'sunday': '4:00\u202fPM\u2009–\u20092:00\u202fAM', 'friday': '4:00\u202fPM\u2009–\u20092:00\u202fAM', 'saturday': '4:00\u202fPM\u2009–\u20092:00\u202fAM', 'wednesday': '4:00\u202fPM\u2009–\u20092:00\u202fAM', 'thursday': '4:00\u202fPM\u2009–\u20092:00\u202fAM'}",https://www.instagram.com/tonyssaloon/,False,2025-05-11 23:49:59.352881+00:00,34.0347305,-118.2316586,ChIJERRXhiHGwoARglmCKcSc30o,,2,4.4,{},CA,"Masculine old-school joint goes hip with craft cocktails & beer plus pool, Ping-Pong & music nights.","Greatest dive bar ever!! ESP for people who don't consider themselves dive bar types.. Great mix of good people looking for a good time, laid back, with lively tunes ! Worth checking out!! | Hi-brow cocktails in a comfortable, low-brow setting. They use excellent, large, clear rocks of ice in their well made Old Fashioned. | One of the best places in LA. Pool, pingpong or darts, you name it. Beatbox with music from all genres and the best staff... just one thing: now you can’t drink in the backyard, wth is up with that?!","bar, point_of_interest, establishment",http://tonyssaloon.com/
Norteno Bar and Grill,"7717 Compton Ave #2611, Los Angeles, CA 90001, USA","BBQ Joint, Mexican Restaurant","13026, 13303",Los Angeles,,2694,4bc630d7d35d9c743151e23a,"{'tuesday': '11:00\u202fAM\u2009–\u20092:00\u202fAM', 'monday': '11:00\u202fAM\u2009–\u20092:00\u202fAM', 'sunday': '11:00\u202fAM\u2009–\u20092:00\u202fAM', 'friday': '11:00\u202fAM\u2009–\u20092:00\u202fAM', 'saturday': '11:00\u202fAM\u2009–\u20092:00\u202fAM', 'wednesday': '11:00\u202fAM\u2009–\u20092:00\u202fAM', 'thursday': '11:00\u202fAM\u2009–\u20092:00\u202fAM'}",,False,2025-05-11 23:56:29.236203+00:00,33.9692817,-118.2479088,ChIJESN24wvJwoAROBn47_QjNNg,,1,4,{},CA,A BBQ Joint and Mexican Restaurant in downtown LA.,"Unlike Aro Latin, Don Chente serves one of the best aguachiles around, its vibrant green sauce bright with lime and chile, the shrimp almost creamy, the avocado topping beautifully ripe. | The moles are fantastic — that's almost a given — and you can choose from mole poblano, the darker mole oaxaqueño or a pepian rojo or a pepian verde, both made with pumpkin seeds. | There's a cream of poblano soup here that is one of the best things I've eaten all year, its vegetal, slightly spicy poblano flavor underpinned by the richness of almonds.","bar, point_of_interest, establishment",
Carnival Karaoke,"17617 Sherman Way, Van Nuys, CA 91406, USA","Arts and Entertainment, Karaoke Bar","10000, 13015",Los Angeles,,1665,4f32c8f919836c91c7fa5c74,"{'tuesday': '6:00\u202fPM\u2009–\u20091:00\u202fAM', 'monday': '6:00\u202fPM\u2009–\u20091:00\u202fAM', 'sunday': '5:00\u202fPM\u2009–\u20091:30\u202fAM', 'friday': '6:00\u202fPM\u2009–\u20092:00\u202fAM', 'saturday': '5:00\u202fPM\u2009–\u20092:00\u202fAM', 'wednesday': '6:00\u202fPM\u2009–\u20091:00\u202fAM', 'thursday': '6:00\u202fPM\u2009–\u20091:30\u202fAM'}",,False,2025-05-12 00:00:21.126749+00:00,34.2014891,-118.5165938,ChIJESnhdImZwoARQ-k6Ajlnacg,,1,4.4,{},CA,"Upbeat karaoke bar featuring private rooms & Asian snacks, plus flavored soju, imported beer & wine.",,"night_club, bar, point_of_interest, establishment",
AC Rooftop Bar,"1260 S Figueroa St, Los Angeles, CA 90015, USA","Arts and Entertainment, Cocktail Bar, Lounge","10000, 13009, 13016",Los Angeles,,2902,4e8e981e9adf0d7c352d1230,,https://www.instagram.com/marriottbonvoy/,False,2025-05-12 00:01:25.332869+00:00,34.0404548,-118.267442,ChIJETp4EyHHwoARgM9l-ZHd33Q,,,,{},CA,"A Arts and Entertainment, Cocktail Bar, and more in downtown LA.","The New Hot Beef Tri-Tip With Arugula, Roasted Red Peppers, Horseradish And Chimichurri On A Toasted Ciabatta Bread Is The Best Seller. 🍽 | The Hot Roasted Turkey French Dip Sandwiches With The Kettle Chips Are The Best. 🍽😋 | The Hot Prime Roast Beef French Dip Sandwiches With The Kettle Chips Is The Best. 🍽😋","bar, restaurant, food, point_of_interest, establishment",https://www.marriott.com/en-us/hotels/laxox-moxy-downtown-los-angeles/dining/?scid=feed67b0-9a2f-4de1-8df6-114544116108
Byblos Mediterranean Restaurant and Hookah Bar,"1964 Westwood Blvd, Los Angeles, CA 90025, USA","Mediterranean Restaurant, Middle Eastern Restaurant","13309, 13302",Los Angeles,,2595,4b2c9c95f964a5201dc824e3,"{'tuesday': '8:00\u202fPM\u2009–\u20092:00\u202fAM', 'monday': 'Closed', 'sunday': '10:00\u202fAM\u2009–\u20092:00\u202fAM', 'friday': '10:00\u202fPM\u2009–\u20092:00\u202fAM', 'saturday': '10:00\u202fPM\u2009–\u20092:00\u202fAM', 'wednesday': 'Closed', 'thursday': '10:00\u202fPM\u2009–\u20092:00\u202fAM'}",,False,2025-05-12 00:00:41.391451+00:00,34.0473123,-118.4344924,ChIJE_59cZy7woAR29_vO4-QsEM,,2,3.7,{},CA,"High-end dining room with creams & golds offering Lebanese fare, a hookah menu & entertainment.","Good restaurant in LA. Great food, service and atmosphere. Love it .. | Great staff and fantastic live entertainment! | This place just went under new ownership and everything got better ... Drinks are excellent food is delectable and the music is bumping ....","bar, restaurant, food, point_of_interest, establishment",
Sweetwater Saloon,"1201 E Broadway, Long Beach, CA 90802, USA",Gay Bar,13011,Los Angeles,,1585,3fd66200f964a520c9ef1ee3,"{'tuesday': '12:00\u202fPM\u2009–\u20092:00\u202fAM', 'monday': '12:00\u202fPM\u2009–\u20092:00\u202fAM', 'sunday': '12:00\u202fPM\u2009–\u20092:00\u202fAM', 'friday': '12:00\u202fPM\u2009–\u20092:00\u202fAM', 'saturday': '12:00\u202fPM\u2009–\u20092:00\u202fAM', 'wednesday': '12:00\u202fPM\u2009–\u20092:00\u202fAM', 'thursday': '12:00\u202fPM\u2009–\u20092:00\u202fAM'}",,False,2025-05-11 23:57:21.395357+00:00,33.7686761,-118.1766384,ChIJF2npLBcx3YARuCXpdbnY3gs,,1,4.5,{},CA,A Gay Bar in downtown LA.,"Fun fun place to grab a drink! The jukebox is fun and I ♥ the old school saloon wooden rickshaw double door at the entrance. | the bartender, Kevin, is so awesome dude! I would love to hug him for hours! He serves awesome drinks! | Kevin on Wednesday is awesome and Eric   is a great bartender too love my guys .....show some love!","bar, point_of_interest, establishment",
Harvard and Stone,"5221 Hollywood Blvd, Los Angeles, CA 90027, USA","Cocktail Bar, American Restaurant","13009, 13068",Los Angeles,,0,4d4dee8a1a2d721ed4019d1d,"{'tuesday': '8:00\u202fPM\u2009–\u20092:00\u202fAM', 'monday': '9:00\u202fPM\u2009–\u20092:00\u202fAM', 'sunday': '9:00\u202fPM\u2009–\u20092:00\u202fAM', 'friday': '9:00\u202fPM\u2009–\u20092:00\u202fAM', 'saturday': '9:00\u202fPM\u2009–\u20092:00\u202fAM', 'wednesday': '9:00\u202fPM\u2009–\u20092:00\u202fAM', 'thursday': '9:00\u202fPM\u2009–\u20092:00\u202fAM'}",,False,2025-05-12 00:50:50.374565+00:00,34.1018877,-118.3042941,ChIJF9gaJFe_woARxjngyfp9qBY,,2,4.3,{},CA,Buzzy bar with a factorylike vibe offers inventive cocktails & burlesque some nights.,"Great unpretentious bar to pick up dudes! Live music regularly and a tiny secret bar in the back with guest bartenders and rotating menu nightly. | Try the tequila Ocho and Mandarine Napoleon margarita. It's so good! They have a cocktail with Atlantico rum too that's awesome. And the ancho Reyes Pierde Almas shot is spicy and smokey! | Harvard & Stone is a faux-grungy hangout with a rollicking band and burlesque dancers. The main bar serves cheeky house cocktails, while the rear Research & Development Bar serves experimental drinks.","bar, point_of_interest, establishment",http://harvardandstone.com/
The Peninsula Sports Bar,"3900 W Manchester Blvd, Inglewood, CA 90305, USA","Concert Hall, Music Venue, Stadium","10051, 10037, 10039",Los Angeles,,1290,47cedc51f964a520064e1fe3,,,False,2025-05-11 23:54:44.134080+00:00,33.9574701,-118.3400651,ChIJFRcABgC3woARFjpThPF0PYo,,,,{},CA,"A Concert Hall, Music Venue, and more in downtown LA.","nice venue with stellar outdoor space with (not cheap)  food and drinks. FYI: row 16 is the last row in the 100 level. super convenient if you drink a lot and need to pee frequently ;) | Been here for Imagine Dragons,very organized and clean,the food shop outside is good with less price,bathrooms was clean, unforgettable night for me. | REAL 92.3 presents a rhyme ridden birthday bash this Sunday. Featured guests include Big Sean, Nicki Minaj, Fetty Wap and DJ Khaled. Attending is the real key to success. Sun, 2/28, 6pm, $44-$130.","bar, point_of_interest, establishment",
Utopia Bar and Lounge,"5047 W Pico Blvd, Los Angeles, CA 90019, USA","Hookah Bar, Cafe, Coffee, and Tea House, Restaurant","13032, 13065, 13012",Los Angeles,,1497,5935cd7c78782c445369f841,,,False,2025-05-11 23:48:42.657927+00:00,34.048215,-118.3475162,ChIJFZebxEi5woARVQe19mbG23Y,,,,{},CA,"A Hookah Bar, Cafe, Coffee, and Tea House, and more in downtown LA.",,"bar, restaurant, food, point_of_interest, establishment",https://www.utopiaonpico.com/
Bodega Wine Bar,"814 Broadway, Santa Monica, CA 90401, USA","Wine Bar, Dining and Drinking","13000, 13025",Los Angeles,,833,4548b1f6f964a5208b3c1fe3,"{'tuesday': '7:00\u202fAM\u2009–\u200910:00\u202fPM', 'monday': '7:00\u202fAM\u2009–\u200910:00\u202fPM', 'sunday': '7:00\u202fAM\u2009–\u200910:00\u202fPM', 'friday': '7:00\u202fAM\u2009–\u200911:00\u202fPM', 'saturday': '7:00\u202fAM\u2009–\u200911:00\u202fPM', 'wednesday': '7:00\u202fAM\u2009–\u200910:00\u202fPM', 'thursday': '7:00\u202fAM\u2009–\u200910:00\u202fPM'}",,False,2025-05-11 23:41:15.383602+00:00,34.0183156,-118.4893379,ChIJFzoSp82kwoARbw9rwj7CCZI,,2,4.5,{},CA,"Pizzas, salads & snacks served in a laid-back destination for a robust selection of coffee, cocktails & wine.","One of my absolute favorite spots for Wine & Cheese night.From the cozy atmosphere to great music selection, this spot offers a great wine menu and yummy small plates to nibble on. | Congrats to Bodega Wine Bar for passing their Clean Bay Restaurant Certification 4 City of Santa Monica! They're doing their part to keep the Santa Monica Bay clean! Learn more: www.santamonicabay.org | The happy hour here runs Mon. through Fri., 5 to 7 pm, then repeats from 10 pm to close Sunday through Thursday. Expect $6 wine and soju and $4 beers. You can also score an $8 pizza or a $6 appetizer.","bar, cafe, store, restaurant, food, point_of_interest, establishment",http://www.bodegawinebar.com/
Q's Billiard Club & Restaurant,"11835 Wilshire Blvd, Los Angeles, CA 90025, USA","Pool Hall, Sports Bar, American Restaurant","13068, 10045, 13022",Los Angeles,,0,3008a059178446fc716fa87a,"{'tuesday': '12:00\u202fPM\u2009–\u20092:00\u202fAM', 'monday': '12:00\u202fPM\u2009–\u20092:00\u202fAM', 'sunday': '9:00\u202fAM\u2009–\u20092:00\u202fAM', 'friday': '12:00\u202fPM\u2009–\u20092:00\u202fAM', 'saturday': '9:00\u202fAM\u2009–\u20092:00\u202fAM', 'wednesday': '12:00\u202fPM\u2009–\u20092:00\u202fAM', 'thursday': '12:00\u202fPM\u2009–\u20092:00\u202fAM'}",https://www.instagram.com/qsbilliards,False,2025-05-12 00:55:27.638164+00:00,34.0476814,-118.4634866,ChIJG10H9F27woAR5BrG8xgU81M,,2,4.2,{},CA,"Hopping, brick-walled lounge with pool tables & lots of TVs serving bar bites & a big beer menu.",,"night_club, bar, restaurant, point_of_interest, food, establishment",http://www.qsbilliardclub.com/
Barney's Beanery,"8447 Santa Monica Blvd, West Hollywood, CA 90069, USA","Sports Bar, BBQ Joint, American Restaurant","13026, 13068, 13022",Los Angeles,,0,3fd66200f964a5202bf01ee3,"{'tuesday': '11:00\u202fAM\u2009–\u20092:00\u202fAM', 'monday': '11:00\u202fAM\u2009–\u20092:00\u202fAM', 'sunday': '11:00\u202fAM\u2009–\u20092:00\u202fAM', 'friday': '11:00\u202fAM\u2009–\u20092:00\u202fAM', 'saturday': '11:00\u202fAM\u2009–\u20092:00\u202fAM', 'wednesday': '11:00\u202fAM\u2009–\u20092:00\u202fAM', 'thursday': '11:00\u202fAM\u2009–\u20092:00\u202fAM'}",https://www.instagram.com/barneysbeanery,False,2025-05-12 00:46:13.735883+00:00,34.0908272,-118.3746086,ChIJG5ysWrm-woARwN5vy6UiJis,,2,4.4,{},CA,"Colorful, buzzing sports bar & grill serving up numerous chili options & other casual pub fare.","I watched football & enjoyed many meals at this sports bar... Everything is delicious.  Last time I got a *ginormous BBQ bacon double meat, double cheese burger... so good! | This is a local institution and a great place to watch a game and enjoy a brew, but calling it a gastropub is like calling Vin Diesel a fine thespian. | The menu is so diverse that this is the only place in the area that my fellow cast mates can agree on after a show. Chili Bacon cheeseburgers AND gluten free vegan stuff. Fun vibe w/ a lot of history.","bar, restaurant, food, point_of_interest, establishment",http://www.barneysbeanery.com/
Rocco's Tavern -Westwood,"1000 Gayley Ave, Los Angeles, CA 90024, USA",Indie Movie Theater,10026,Los Angeles,,812,4baee5d5f964a52063e03be3,"{'tuesday': '3:00\u2009–\u200910:00\u202fPM', 'monday': '3:00\u2009–\u200910:00\u202fPM', 'sunday': '9:00\u202fAM\u2009–\u200910:00\u202fPM', 'friday': '12:00\u202fPM\u2009–\u20092:00\u202fAM', 'saturday': '12:00\u202fPM\u2009–\u20092:00\u202fAM', 'wednesday': '3:00\u2009–\u200910:00\u202fPM', 'thursday': '3:00\u202fPM\u2009–\u20092:00\u202fAM'}",https://www.instagram.com/roccostavern/,False,2025-05-12 00:00:44.095605+00:00,34.0618939,-118.4476878,ChIJG8E_l4O8woARfo9O-8qHCuk,,2,4.2,{},CA,A Indie Movie Theater in downtown LA.,"Great historic theatre, friendly staff and management, and the balcony seating is top notch. Dolby atmos equipped now too. | Concessions are expensive, except for the hot dogs, which makes you kind of wonder what's in them.. | Bruins have been going to the Fox Theater since it was opened in 1931. Try and catch a red carpet premiere.","bar, point_of_interest, establishment",https://roccos-tavern.club/
Rocco’s WeHo,"8900 Santa Monica Blvd, West Hollywood, CA 90069, USA","Night Club, Gay Bar, Pizzeria","10032, 13064, 13011",Los Angeles,,0,5cc40b5295a722002cf381fd,"{'tuesday': '3:00\u202fPM\u2009–\u20092:00\u202fAM', 'monday': '3:00\u202fPM\u2009–\u20092:00\u202fAM', 'sunday': '12:00\u202fPM\u2009–\u20092:00\u202fAM', 'friday': '12:00\u202fPM\u2009–\u20092:00\u202fAM', 'saturday': '12:00\u202fPM\u2009–\u20092:00\u202fAM', 'wednesday': '3:00\u202fPM\u2009–\u20092:00\u202fAM', 'thursday': '3:00\u202fPM\u2009–\u20092:00\u202fAM'}",https://www.instagram.com/roccosweho/,False,,34.0846112,-118.3841377,ChIJGbJj-Ga_woAR4yOWQ08ikfg,,2,3.9,{},CA,"Classic menu & drinks offered in a lively, industrial spot with a covered terrace, plus drag shows.","Great atmosphere! A great welcome to Weho! | The sound system is everything here! Be ready to move those feet, henny. | Rocco's in West Hollywood hosted a drag brunch that was a blast! Great food, fabulous entertainment, and a lively atmosphere made for an unforgettable experience.","restaurant, point_of_interest, food, establishment",https://www.roccosweho.com/
Frank 'n Hank,"518 S Western Ave, Los Angeles, CA 90020, USA",Dive Bar,13010,Los Angeles,,0,3fd66200f964a5204aef1ee3,"{'tuesday': '6:00\u202fPM\u2009–\u20092:00\u202fAM', 'monday': '6:00\u202fPM\u2009–\u20092:00\u202fAM', 'sunday': '6:00\u202fPM\u2009–\u20092:00\u202fAM', 'friday': '6:00\u202fPM\u2009–\u20092:00\u202fAM', 'saturday': '6:00\u202fPM\u2009–\u20092:00\u202fAM', 'wednesday': '6:00\u202fPM\u2009–\u20092:00\u202fAM', 'thursday': '6:00\u202fPM\u2009–\u20092:00\u202fAM'}",,False,2025-05-12 00:56:39.586073+00:00,34.0647274,-118.3089035,ChIJGdwuWpq4woARjrtWZMlRwzQ,,1,4.5,{},CA,"Watering hole with a pool table & jukebox set in a dimly lit, wood-paneled room.","Love this dive bar. Snow behind the bar makes good, stiff drinks. Cheap beers and $3 rum & cokes. | haven't been here in a while..don't know why;; great local dive bar but cash only. super friendly bartender n cheap drinks. snow!!!! ;) | Best dive bar around! Cheap stiff drinks, and most top shelf liquors are only $5-6!!","night_club, bar, point_of_interest, establishment",
State Social House,"8782 W Sunset Blvd, West Hollywood, CA 90069, USA","Gastropub, American Restaurant, Italian Restaurant","13057, 13236, 13068",Los Angeles,,1945,5215418d11d2d0ca736aa243,"{'tuesday': '4:00\u202fPM\u2009–\u20092:00\u202fAM', 'monday': '12:30\u2009–\u20092:00\u202fAM, 4:00\u202fPM\u2009–\u20092:00\u202fAM', 'sunday': '12:30\u2009–\u20092:00\u202fAM, 11:30\u202fAM\u2009–\u200912:00\u202fAM', 'friday': '4:00\u202fPM\u2009–\u20092:00\u202fAM', 'saturday': '11:30\u202fAM\u2009–\u200912:00\u202fAM', 'wednesday': '4:00\u202fPM\u2009–\u20092:00\u202fAM', 'thursday': '4:00\u202fPM\u2009–\u20092:00\u202fAM'}",https://www.instagram.com/stateweho/,False,2025-05-11 23:47:42.775056+00:00,34.0908859,-118.3827028,ChIJGfCWFaO-woARIkdWtWOx18g,,2,4.3,{},CA,Rustic-chic gastropub plating American comfort food & offering a cigar lounge & upstairs piano bar.,"Totally unbelievably reasonable happy hour. Beautiful bartenders. Great location for people watching outside or occasional douche watching inside. | There isn't much to not like about this place. My business partner and myself love this place. We've turned our friends into State Social-ites. Definitely, a great 'Man Cave' with awesome service. | Happy hour meatball sliders are pretty good. A order comes with 3 and are small. So if you're hungry or splitting them you might want two orders but tasty :)","bar, night_club, restaurant, food, point_of_interest, establishment",https://statesocialhouse.com/
Peppermint Club,"8713 Beverly Blvd, West Hollywood, CA 90048, USA","Night Club, Lounge, Restaurant","10032, 13065, 13016",Los Angeles,,2596,587b1fe7e786b26b0d57837b,"{'tuesday': 'Closed', 'monday': 'Closed', 'sunday': 'Closed', 'friday': '8:00\u202fPM\u2009–\u20092:00\u202fAM', 'saturday': '8:00\u202fPM\u2009–\u20092:00\u202fAM', 'wednesday': 'Closed', 'thursday': 'Closed'}",,False,2025-05-11 23:45:46.230759+00:00,34.0771589,-118.3809607,ChIJGfIhhrK-woAR1tL7_o3NYko,,2,4,{},CA,"Buzzy nightlife hot spot with innovative craft cocktails, DJs & bottle service in sleek, sexy space.","Legendary jazz club right in West Hollywood - great ambiance, good artists come often check their site and buy tickets online | Classy Old Hollywood vibes. Cozy. A wonderfully intimate venue to see a favorite artist.FYI Bar is limited / doesnt appear to have a menu | Everything","bar, restaurant, food, point_of_interest, establishment",http://www.peppermintclub.com/
Alteño Sports Bar,"8554 Washington Blvd, Culver City, CA 90232, USA",Liquor Store,17076,Los Angeles,,1716,510c5e68e4b00423d0bc2ad2,"{'tuesday': '2:00\u202fPM\u2009–\u20092:00\u202fAM', 'monday': '2:00\u202fPM\u2009–\u20092:00\u202fAM', 'sunday': '2:00\u202fPM\u2009–\u20092:00\u202fAM', 'friday': '2:00\u202fPM\u2009–\u20092:00\u202fAM', 'saturday': '2:00\u202fPM\u2009–\u20092:00\u202fAM', 'wednesday': '2:00\u202fPM\u2009–\u20092:00\u202fAM', 'thursday': '2:00\u202fPM\u2009–\u20092:00\u202fAM'}",,False,2025-05-11 23:44:37.607069+00:00,34.03049229999999,-118.3805693,ChIJH-Pwz5y5woARadZuHvBKMQw,,,4.1,{},CA,A Liquor Store in downtown LA.,"Love this place. Fun & very knowledgeable staff. All natural made products. Decent value. Some prices are good deals while some others are a little more expensive. Great tasting events. | Excellent selection of wine and spirits. Friendly staff. If you're looking for ""cheap"" options, go to Ralph's. If you want a wide selection of interesting booze, come here. | Cute little liquor store. Sells all the stuff you can't find in a regular liquor store. Higher quality too.","bar, point_of_interest, establishment",
Star Leaf – Asian Fusion Bar & Grille,"641 E Colorado Blvd, Pasadena, CA 91101, USA","Coffee Shop, Restaurant","13065, 13035",Los Angeles,,700,5fb86804510818706b1fbc33,"{'tuesday': '11:00\u202fAM\u2009–\u20099:30\u202fPM', 'monday': '11:00\u202fAM\u2009–\u20099:30\u202fPM', 'sunday': '11:00\u202fAM\u2009–\u20099:30\u202fPM', 'friday': '11:00\u202fAM\u2009–\u200910:00\u202fPM', 'saturday': '11:00\u202fAM\u2009–\u200910:00\u202fPM', 'wednesday': '11:00\u202fAM\u2009–\u20099:30\u202fPM', 'thursday': '11:00\u202fAM\u2009–\u20099:30\u202fPM'}",https://www.instagram.com/starleafusa/,False,2025-05-11 23:59:28.214662+00:00,34.1461807,-118.1371414,ChIJH2h9jgTDwoARASXsuxeS-6s,,3,4.1,{},CA,A Coffee Shop and Restaurant in downtown LA.,Great little coffee shop just opened on Lake & Union! | get the sea salt caramel latte (hot or cold). limited indoor seating but more outside. didn’t check outlet situation but could be good work spot. small parking lot but street availability not too bad,"restaurant, bar, point_of_interest, food, establishment",https://www.starleafusa.com/menus
East Grand Bar & Grille,"1985 E Grand Ave, El Segundo, CA 90245, USA","Sports Bar, American Restaurant, Steakhouse","13068, 13022, 13383",Los Angeles,,1602,4bd305ed41b9ef3bf40effe5,"{'tuesday': '6:00\u2009–\u200910:00\u202fAM, 4:00\u2009–\u200910:00\u202fPM', 'monday': '6:00\u2009–\u200910:00\u202fAM, 4:00\u2009–\u200910:00\u202fPM', 'sunday': '6:00\u2009–\u200910:00\u202fAM, 4:00\u2009–\u200910:00\u202fPM', 'friday': '6:00\u2009–\u200910:00\u202fAM, 4:00\u2009–\u200910:00\u202fPM', 'saturday': '6:00\u2009–\u200910:00\u202fAM, 4:00\u2009–\u200910:00\u202fPM', 'wednesday': '6:00\u2009–\u200910:00\u202fAM, 4:00\u202fPM\u2009–\u200912:00\u202fAM', 'thursday': '12:00\u2009–\u200910:00\u202fAM, 4:00\u2009–\u200910:00\u202fPM'}",,False,2025-05-11 23:55:19.711317+00:00,33.919769,-118.391737,ChIJH5RrwbK2woARSkOHQmMe7aU,,,3.9,{},CA,"Relaxed hotel spot serving beer, wine & an American menu with California-inspired seafood dishes.",,"bar, restaurant, food, point_of_interest, establishment",
El Tenampa Bar,"8002 Seville Ave, Huntington Park, CA 90255, USA","Night Club, Sports Bar, Mexican Restaurant","10032, 13022, 13303",Los Angeles,,2841,4f32c0db19836c91c7f6c649,"{'tuesday': '2:00\u202fPM\u2009–\u200912:00\u202fAM', 'monday': '2:00\u202fPM\u2009–\u200912:00\u202fAM', 'sunday': '2:00\u202fPM\u2009–\u20092:00\u202fAM', 'friday': '2:00\u202fPM\u2009–\u200912:00\u202fAM', 'saturday': '2:00\u202fPM\u2009–\u200912:00\u202fAM', 'wednesday': '2:00\u202fPM\u2009–\u200912:00\u202fAM', 'thursday': '2:00\u202fPM\u2009–\u200912:00\u202fAM'}",,False,2025-05-11 23:56:27.334072+00:00,33.9654427,-118.2222918,ChIJH8TNHUTJwoAR7NXeCb79zkA,,,4.2,{},CA,"A Night Club, Sports Bar, and more in downtown LA.",,"night_club, bar, point_of_interest, establishment",
The Bungalow Santa Monica,"101 Wilshire Blvd, Santa Monica, CA 90401, USA",Lounge,13016,Los Angeles,,0,a5478f91355c024a05d76d11,"{'tuesday': 'Closed', 'monday': 'Closed', 'sunday': '2:00\u2009–\u200910:00\u202fPM', 'friday': '5:00\u202fPM\u2009–\u20092:00\u202fAM', 'saturday': '2:00\u202fPM\u2009–\u20092:00\u202fAM', 'wednesday': '5:00\u202fPM\u2009–\u200912:00\u202fAM', 'thursday': '5:00\u202fPM\u2009–\u20092:00\u202fAM'}",,False,2025-05-12 00:41:42.315348+00:00,34.01745700000001,-118.501492,ChIJHRAmNsSkwoARWsE8WVQPhcw,,3,4.3,{},CA,"Sprawling, retro-style space with a handsome bar, a surf-themed billiards room, a patio & more.",,"bar, night_club, point_of_interest, establishment",http://www.thebungalow.com/
Cabo Cantina,"30 Washington Blvd, Marina Del Rey, CA 90292, USA","Sports Bar, Mexican Restaurant","13022, 13303",Los Angeles,,708,4ae493a2f964a520da9b21e3,"{'tuesday': '11:30\u202fAM\u2009–\u200912:00\u202fAM', 'monday': '11:30\u202fAM\u2009–\u200912:00\u202fAM', 'sunday': '11:30\u202fAM\u2009–\u200912:00\u202fAM', 'friday': '11:30\u202fAM\u2009–\u20091:00\u202fAM', 'saturday': '11:30\u202fAM\u2009–\u20091:00\u202fAM', 'wednesday': '11:30\u202fAM\u2009–\u200912:00\u202fAM', 'thursday': '11:30\u202fAM\u2009–\u200912:00\u202fAM'}",https://www.instagram.com/cabocantina,False,2025-05-11 23:42:02.459885+00:00,33.9793861,-118.4658583,ChIJHS0bQI66woARjL5I73m_T5I,,2,4.1,{},CA,"Relaxed local chain with Mexican fare & margaritas, plus multiple TVs & live sports screenings.","Upgrade your margarita to one of the 36oz mega margaritas and watch a football game in one of the many TVs around the bar. Like how they actually play sports commentary rather than music. | Upstairs is the best spot. T.V.'s, open air, beach views! Get the burrito & drink special! To for one sucks! It only applies to one drink, don't let them try to pull a quick one on you! Nice views! 👍 | I had the best eggs scramble with fresh avocado, jalapeños, etc. Enjoyed it and service was great.","bar, restaurant, food, point_of_interest, establishment",http://www.cabocantina.com/
