name,address,categories,category_ids,city,description,distance,foursquare_id,hours,instagram_url,is_nightlife,last_fsq_refresh,lat,lng,place_id,popularity,price_level,rating,social_media,state,summary,tips,types,website
Homage Brewing,"1219 N Main St, Los Angeles, CA 90012, USA","Bar, Brewery, Restaurant","13065, 13003, 13029",,,,60ce49e3c0ee5e0ea9f168dd,"{'tuesday': '3:00\u2009–\u200910:00\u202fPM', 'monday': '3:00\u2009–\u200910:00\u202fPM', 'sunday': '12:00\u2009–\u200910:00\u202fPM', 'friday': '12:00\u202fPM\u2009–\u20092:00\u202fAM', 'saturday': '12:00\u202fPM\u2009–\u20092:00\u202fAM', 'wednesday': '3:00\u2009–\u200910:00\u202fPM', 'thursday': '3:00\u2009–\u200910:00\u202fPM'}",https://www.instagram.com/homagebrewing,False,,34.0646724,-118.2324719,ChIJQzatpaPHwoARUfPRURrOsJ4,,,,{},,"A Bar, Brewery, and more in downtown LA.",This is a 6 pack. I bought it because it's good beer. The staff argued with me that it's a 6 pack. | The beer is very good but the service is outrageously bad.,"night_club, bar, restaurant, food, point_of_interest, establishment",
Apt 200,"7746 Santa Monica Blvd, West Hollywood, CA 90046, USA","Cocktail Bar, Lounge, Restaurant","13016, 13009, 13065",,,,5676553a498e2f30aa99ac1d,"{'tuesday': '10:00\u202fPM\u2009–\u20092:00\u202fAM', 'monday': 'Closed', 'sunday': '10:00\u202fPM\u2009–\u20092:00\u202fAM', 'friday': '10:00\u202fPM\u2009–\u20092:00\u202fAM', 'saturday': '10:00\u202fPM\u2009–\u20092:00\u202fAM', 'wednesday': 'Closed', 'thursday': '10:00\u202fPM\u2009–\u20092:00\u202fAM'}",,False,,34.09063620000001,-118.3581795,ChIJWcYU50O_woARMNRp6SYPbnE,,,,{},,"A Cocktail Bar, Lounge, and more in downtown LA.","Deco and music on point. All your azns in one spot. $2 parking with validation in attached garage, which is the best thing ever. Worst thing? Only 1 girls bathroom...","night_club, point_of_interest, establishment",
The Friend Silverlake,"2611 Hyperion Ave, Los Angeles, CA 90027, USA",Massage Clinic,11070,,,,588ebfbe5289302f30003eb1,,,False,,34.1059742,-118.2728133,ChIJHXjSzcvAwoARd3hIrehmvvQ,,2,,{},,A Massage Clinic in downtown LA.,"Midday wind me down: $35 for a 25 min massage, plus the option to go deep tissue for an extra $10. I wish they had locations in NYC. | Just wonderful the whole experience!","bar, point_of_interest, establishment",
Jumbo's Clown Room,"5153 Hollywood Blvd, Los Angeles, CA 90027, USA","Cocktail Bar, Lounge, Restaurant","13016, 13009, 13065",,,,3fd66200f964a5208aee1ee3,"{'tuesday': 'Closed', 'monday': 'Closed', 'sunday': '8:00\u202fPM\u2009–\u20092:00\u202fAM', 'friday': '8:00\u202fPM\u2009–\u20092:00\u202fAM', 'saturday': '8:00\u202fPM\u2009–\u20092:00\u202fAM', 'wednesday': '8:00\u202fPM\u2009–\u20092:00\u202fAM', 'thursday': '8:00\u202fPM\u2009–\u20092:00\u202fAM'}",https://www.instagram.com/jumbosclownroomofficial/,False,,34.1020277,-118.3024192,ChIJ1UQFAFe_woAR7Y2W2azde40,,2,,{},,"A Cocktail Bar, Lounge, and more in downtown LA.","Highlight of LA! This place has so much atmosphere, even on a Tuesday! The girls are smokin', super talented, the drinks are cheap and the music is good! Be sure to bring bills to tip the dancers! | One of the nicest strip clubs ever. Nice girls, nice barkeepers and a nice crowd! Almost didn't change in the last 20 years except for parking that gets more difficult every year. | Born in 1970, chill out at one of Hollywood’s hottest exotic dance bars. Who doesn’t like some good ol’ pole dancing to 80s hits and rock music?","night_club, bar, point_of_interest, establishment",
Pangea Sound parties,"4067 W Pico Blvd, Los Angeles, CA 90019, USA","Hotel Bar, Cocktail Bar","13009, 13013",,,,4c07d9673cbed13a700e0cc0,"{'tuesday': 'Closed', 'monday': 'Closed', 'sunday': 'Closed', 'friday': '8:00\u202fPM\u2009–\u20092:00\u202fAM', 'saturday': '8:00\u202fPM\u2009–\u20092:00\u202fAM', 'wednesday': 'Closed', 'thursday': '8:00\u202fPM\u2009–\u20092:00\u202fAM'}",https://www.instagram.com/catchonela/,False,,34.0478213,-118.3241408,ChIJ2ZYL9V-4woARSIRHV49_n70,,2,,{},,A Hotel Bar and Cocktail Bar in downtown LA.,,"night_club, bar, point_of_interest, establishment",
Lol Wine Bar,"5140 W Sunset Blvd, Los Angeles, CA 90027, USA","Coffee Shop, Restaurant","13065, 13035",,,,5856f788158b966de017c324,"{'tuesday': '5:00\u2009–\u200911:00\u202fPM', 'monday': 'Closed', 'sunday': '5:00\u2009–\u200911:00\u202fPM', 'friday': '5:00\u202fPM\u2009–\u200912:00\u202fAM', 'saturday': '5:00\u202fPM\u2009–\u200912:00\u202fAM', 'wednesday': '5:00\u2009–\u200911:00\u202fPM', 'thursday': '5:00\u2009–\u200911:00\u202fPM'}",https://www.instagram.com/lolowinebar/,False,,34.0979222,-118.3020145,ChIJk0aWgYC_woAR-ZMeTxnBc8Q,,2,,{},,A Coffee Shop and Restaurant in downtown LA.,"I like the coffee in this shop. They served the most delicious coffees in the town. One thing that  I loved in this coffee shop. It was so elegant and cozy. The barista was so polite and approachable. | Loved everything about Tilt while working remote. The espresso was superb, my crossiant buttery, the space full of sunshine/plants/seating, & the owners were super friendly. There's even strong wifi! | Their cortados are delicious!","restaurant, liquor_store, bar, food, point_of_interest, store, establishment",
El Chucho,"12821 Venice Blvd., Los Angeles, CA 90066, USA",Monument,16026,,,,49e7a26bf964a520ef641fe3,"{'tuesday': '6:00\u202fPM\u2009–\u200912:00\u202fAM', 'monday': 'Closed', 'sunday': '6:00\u202fPM\u2009–\u200912:00\u202fAM', 'friday': '6:00\u202fPM\u2009–\u20092:00\u202fAM', 'saturday': '6:00\u202fPM\u2009–\u20092:00\u202fAM', 'wednesday': '6:00\u202fPM\u2009–\u200912:00\u202fAM', 'thursday': '6:00\u202fPM\u2009–\u20092:00\u202fAM'}",,False,,34.0001685,-118.4412385,ChIJjyyKoPm7woARQmKXDc_jJhA,,,,{},,A Monument in downtown LA.,"Although there was great controversy over the founding of this place, it is a great place to learn some Mexican-American heritage that started in Los Angeles | You'd get a feeling that you're in a place you are not. I love going alone here. There are many families and stalls and food stores. Really fun. | ""America Tropical"" was painted on the Italian Hall at El Pueblo in 1932, but whitewashed shortly after. The mural recently finished up a long-term conservation.","bar, point_of_interest, establishment",
The Ruby Fruit,"3510 W Sunset Blvd, Los Angeles, CA 90026, USA",Wine Bar,13025,,,,63eee7df9b981363cf957832,"{'tuesday': 'Closed', 'monday': 'Closed', 'sunday': '3:00\u2009–\u200910:00\u202fPM', 'friday': '3:00\u2009–\u200911:00\u202fPM', 'saturday': '3:00\u2009–\u200911:00\u202fPM', 'wednesday': '3:00\u2009–\u200910:00\u202fPM', 'thursday': '3:00\u2009–\u200910:00\u202fPM'}",,False,,34.0888679,-118.2769866,ChIJf7uGlCDHwoAR6zTb332HhWs,,2,,{},,A Wine Bar in downtown LA.,,"bar, restaurant, food, point_of_interest, establishment",
The Varnish,"118 E 6th St, Los Angeles, CA 90014, USA","Arts and Entertainment, Cocktail Bar","10000, 13009",,,,3cb41ec0010f4509a42981a9,,https://www.instagram.com/theoriginalvarnishbar,False,,34.0447898,-118.2495086,ChIJgZ1snzXGwoARDUixX2bXiIg,,2,,{},,A Arts and Entertainment and Cocktail Bar in downtown LA.,,"bar, point_of_interest, establishment",
AKBar,"4356 W Sunset Blvd, Los Angeles, CA 90029, USA","Gay Bar, Night Club","10032, 13011",,,,3fd66200f964a520e3ee1ee3,"{'tuesday': '4:00\u202fPM\u2009–\u20092:00\u202fAM', 'monday': '4:00\u202fPM\u2009–\u20092:00\u202fAM', 'sunday': '4:00\u202fPM\u2009–\u20092:00\u202fAM', 'friday': '4:00\u202fPM\u2009–\u20092:00\u202fAM', 'saturday': '4:00\u202fPM\u2009–\u20092:00\u202fAM', 'wednesday': '4:00\u202fPM\u2009–\u20092:00\u202fAM', 'thursday': '4:00\u202fPM\u2009–\u20092:00\u202fAM'}",,False,,34.0956782,-118.2842667,ChIJOwpNUEzHwoARAPHUIkcyjdM,,1,,{},,A Gay Bar and Night Club in downtown LA.,"Small place but you'll find all the hip people here. There's are two small bar areas with cheap drinks, and then a square dance floor. Check the website for the theme of the night. | Akbar is intimate, casual, friendly, no-frills, and cheap. It's like a gay Cheers—everybody knows your name, from the bartender to the door man to the DJ. | AW: gay bar, dive bar, neighborhood bar, dance bar, and one of SL's most fun bars. Epic DJ nights but also a very chill place to drink cheap, strong drinks on a Sunday night.","night_club, bar, point_of_interest, establishment",
Club Baha,"1130 W Sunset Blvd, Los Angeles, CA 90012, USA","Night Club, Bar","10032, 13003",,,,4c11ef6017002d7f2d11e709,"{'tuesday': 'Closed', 'monday': '8:00\u202fPM\u2009–\u200912:00\u202fAM', 'sunday': 'Closed', 'friday': '8:00\u202fPM\u2009–\u20092:00\u202fAM', 'saturday': '8:00\u202fPM\u2009–\u20092:00\u202fAM', 'wednesday': 'Closed', 'thursday': '8:00\u202fPM\u2009–\u200912:00\u202fAM'}",,False,,34.0663707,-118.2498937,ChIJ1V0kgP_GwoARM9EDnuWIFFo,,2,,{},,A Night Club and Bar in downtown LA.,Baile......!,"night_club, point_of_interest, establishment",
Zouk Los Angeles,"643 La Cienega Blvd, West Hollywood, CA 90069, USA",Hotel,19014,,,,62be6d10b04537418e8fe817,"{'tuesday': 'Closed', 'monday': 'Closed', 'sunday': 'Closed', 'friday': '10:30\u202fPM\u2009–\u20092:00\u202fAM', 'saturday': '10:30\u202fPM\u2009–\u20092:00\u202fAM', 'wednesday': '10:30\u202fPM\u2009–\u20092:00\u202fAM', 'thursday': 'Closed'}",https://www.instagram.com/zoukla/,False,,34.0833108,-118.3766453,ChIJHdYvUgC_woARfMhJYYZN6wE,,,,{},,A Hotel in downtown LA.,Beautiful hotel space with wonderful views of DTLA.,"night_club, point_of_interest, establishment",
Bar Flores,"1542 W Sunset Blvd, Los Angeles, CA 90026, USA","Cocktail Bar, Restaurant","13009, 13065",,,,5d4e746d61835c0008428269,"{'tuesday': '4:00\u202fPM\u2009–\u20092:00\u202fAM', 'monday': '4:00\u202fPM\u2009–\u20092:00\u202fAM', 'sunday': '12:00\u202fPM\u2009–\u20092:00\u202fAM', 'friday': '4:00\u202fPM\u2009–\u20092:00\u202fAM', 'saturday': '12:00\u202fPM\u2009–\u20092:00\u202fAM', 'wednesday': '4:00\u202fPM\u2009–\u20092:00\u202fAM', 'thursday': '4:00\u202fPM\u2009–\u20092:00\u202fAM'}",https://www.instagram.com/barflores_la/,False,,34.0763647,-118.2568436,ChIJlSiO2YPHwoARUaXxL_wD-Gg,,3,,{},,A Cocktail Bar and Restaurant in downtown LA.,Amazing cocktails and some of the best tamales I’ve ever had. | Amazing bar good drinks amazing ambience good music great date spot | Feels like a mix of Spanish villa and cocktail bar. The michelada was tasty.,"bar, point_of_interest, establishment",
Hi Tops Weho,"8933 Santa Monica Blvd, West Hollywood, CA 90069, USA",Gay Bar,13011,Los Angeles,,0,5b888d1abcbf7a002c6e7a7d,"{'tuesday': '12:00\u202fPM\u2009–\u200912:00\u202fAM', 'monday': '12:00\u202fPM\u2009–\u200912:00\u202fAM', 'sunday': '12:00\u202fPM\u2009–\u200912:00\u202fAM', 'friday': '12:00\u202fPM\u2009–\u20092:00\u202fAM', 'saturday': '12:00\u202fPM\u2009–\u20092:00\u202fAM', 'wednesday': '12:00\u202fPM\u2009–\u200912:00\u202fAM', 'thursday': '12:00\u202fPM\u2009–\u20092:00\u202fAM'}",,False,,34.0845069,-118.3852114,ChIJ-2jPFoy_woARDEkiTHaBHpc,,2,3.9,{},CA,"Convivial gay pub with TVs for sports, trivia nights & a menu of classic bar food with a twist.",Nice bar for a pint & a bite to eat while watching the sports highly recommended | Nice bar for pint & bite to eat while watching the sports highly recommended | Nice bar for a pint & a bite to eat while watching the sports highly recommended by me,"bar, point_of_interest, establishment",http://www.hitopsbar.com/
VLounge Bar And Night Club,"6101 Reseda Blvd, Tarzana, CA 91335, USA","Music Venue, Bar, Restaurant","13065, 13003, 10039",Los Angeles,,2274,031d208c5eeb4ed63258a022,"{'tuesday': '7:00\u202fPM\u2009–\u20092:00\u202fAM', 'monday': 'Closed', 'sunday': 'Closed', 'friday': '9:00\u202fPM\u2009–\u20092:00\u202fAM', 'saturday': '9:00\u202fPM\u2009–\u20092:00\u202fAM', 'wednesday': '9:00\u202fPM\u2009–\u20092:00\u202fAM', 'thursday': '9:30\u202fPM\u2009–\u20092:00\u202fAM'}",,False,2025-05-12 00:00:26.244709+00:00,34.1809978,-118.5365376,ChIJ-T04RouZwoARiL8_rWJPOm0,,,3.5,{},CA,"A Music Venue, Bar, and more in downtown LA.",,"night_club, bar, point_of_interest, establishment",
Marina Grill & Bar,"4200 Admiralty Way, Marina Del Rey, CA 90292, USA","Cocktail Bar, American Restaurant","13009, 13068",Los Angeles,,1135,51dadcc450194ec38c05fabc,"{'tuesday': '5:00\u2009–\u200910:00\u202fPM', 'monday': '5:00\u2009–\u200910:00\u202fPM', 'sunday': '5:00\u2009–\u200910:00\u202fPM', 'friday': '5:00\u202fPM\u2009–\u200912:00\u202fAM', 'saturday': '12:00\u2009–\u200910:00\u202fAM, 5:00\u2009–\u200910:00\u202fPM', 'wednesday': '5:00\u2009–\u200910:00\u202fPM', 'thursday': '5:00\u2009–\u200910:00\u202fPM'}",,False,2025-05-11 23:42:26.268701+00:00,33.9837487,-118.4572739,ChIJ-bh-_5m6woARz7eo_76zQbc,,,4.3,{},CA,"Indoor/outdoor hotel eatery provides all-day Californian fare in comfy, contemporary surrounds.",Don't miss back-to-back Happy Hour all week long! 4pm - 8pm and 8pm - 11pm with exclusive E3 $3 Specials! | We are celebrating our first anniversary...and you're invited! Save 20% when you join us for breakfast or dinner tomorrow (6/20)! | Happy Hour is awesome! Solid service and right in hotel,"bar, restaurant, food, point_of_interest, establishment",https://hiltongardeninn3.hilton.com/en/hotels/california/hilton-garden-inn-los-angeles-marina-del-rey-LAXDRGI/dining/index.html
Intercrew,"3330 Wilshire Blvd, Los Angeles, CA 90010, USA","Cocktail Bar, Lounge, Restaurant","13016, 13009, 13065",Los Angeles,,0,f1c36c67e6cb49b9a65b7f79,"{'tuesday': 'Closed', 'monday': 'Closed', 'sunday': 'Closed', 'friday': '10:00\u202fPM\u2009–\u20092:00\u202fAM', 'saturday': '10:00\u202fPM\u2009–\u20092:00\u202fAM', 'wednesday': 'Closed', 'thursday': 'Closed'}",,False,,34.0616237,-118.2952219,ChIJ-d2p7hHHwoARNhybOcI1Nec,,3,4.4,{},CA,"A Cocktail Bar, Lounge, and more in downtown LA.","Intercrew caters to diverse tastes. Whether you're craving traditional Korean flavors or a taste of home, this neighborhood eatery delivers a satisfying dining experience. They serve cocktails too.","night_club, point_of_interest, establishment",http://www.intercrewla.com/
The Cinema Bar,"3967 Sepulveda Blvd, Culver City, CA 90230, USA","Dive Bar, Lounge, Restaurant","13016, 13065, 13010",Los Angeles,,2221,43b52205f964a520c32c1fe3,"{'tuesday': '2:00\u202fPM\u2009–\u20092:00\u202fAM', 'monday': '2:00\u202fPM\u2009–\u20092:00\u202fAM', 'sunday': '2:00\u202fPM\u2009–\u20092:00\u202fAM', 'friday': '2:00\u202fPM\u2009–\u20092:00\u202fAM', 'saturday': '2:00\u202fPM\u2009–\u20092:00\u202fAM', 'wednesday': '2:00\u202fPM\u2009–\u20092:00\u202fAM', 'thursday': '2:00\u202fPM\u2009–\u20092:00\u202fAM'}",https://www.instagram.com/thehighrevival/,False,2025-05-11 23:44:30.622118+00:00,34.0094025,-118.4147021,ChIJ-d41Nj-6woARz_c1sqYzY_c,,1,4.4,{},CA,"Stalwart veteran film-inspired hangout offering live music, a patio hang space & drinks.","Tiny bar but, Everybody can still squeeze in and have a seat by the bar. Look for the local Spanish singing band that occasionaly comes in, i forget their name. The ""Gente!, Gente!"" Song! They Rock!👍 | Where can I drink a get, on a patio preferably, with a tankfish? Cut a thick slice out of Preservation Hall straight outta N'awlins, via' French Django jazz band that eventually makes fishtank gumbo | Zagat rated this bar the #6 bar in all of LA. Seriously. Come.","bar, point_of_interest, establishment",http://www.thecinemabar.com/
Ixtapa Cantina & Lounge,"119 E Colorado Blvd, Pasadena, CA 91105, USA",Mexican Restaurant,13303,Los Angeles,,692,4b0754b4f964a52020fc22e3,"{'tuesday': '8:00\u202fPM\u2009–\u20091:00\u202fAM', 'monday': 'Closed', 'sunday': '8:00\u2009–\u200910:00\u202fPM', 'friday': '8:00\u202fPM\u2009–\u20092:00\u202fAM', 'saturday': '8:00\u202fPM\u2009–\u20092:00\u202fAM', 'wednesday': '8:00\u2009–\u200911:00\u202fPM', 'thursday': '8:00\u202fPM\u2009–\u20091:30\u202fAM'}",https://www.instagram.com/ixtapacantina/,False,2025-05-11 23:58:03.092041+00:00,34.1459541,-118.14781,ChIJ-zy203HDwoARgNC1NKiPOZM,,2,4,{},CA,"High-energy Mexican eatery & gathering place, including a bar with guest DJs & a dance floor.","This popular spot’s happy hour is from 4-7pm daily, and has such specials as $2 tacos, $3 bacon wrapped hot dogs, $3 nachos, and $4 tostadas. There’s also an array of drink specials as well. | In Ixtapa 1/16–1/26?  Want a trip that will take u beyond the basic touristy spots? ‘VACATION CRASHERS’, a new TV series,will put the adventure back into your trip. Contact vacationcrashers@yahoo.com | The happy hour is 4pm - 7pm Velasco is usually the bartender","night_club, bar, point_of_interest, establishment",http://www.cantinaixtapa.com/
SoFi Member Lounge,"XM26+HF, Inglewood, CA 90305, USA",Stadium,10051,Los Angeles,,1739,582b29a3b39f964d7566fe10,,,False,2025-05-11 23:54:49.648942+00:00,33.9517096,-118.3385843,ChIJ0SNQJgC3woARXCAsY3z2ewY,,,4.7,{},CA,A Stadium in downtown LA.,"Beautiful stadium, any seat is a great seat | Beautiful brand new stadium BUT - bizarrely LOUSY food, disorganized workers not knowing where anything is or how to get anywhere, parking a mess. I mean seriously?? | It’s new, still working out some stuff. The video board is a site to see. Pictures and photos do not do it justice","night_club, bar, point_of_interest, establishment",
Terrace Restaurant & Lounge,"112 N San Fernando Blvd, Burbank, CA 91502, USA","Dining and Drinking, Lounge, Hookah Bar","13000, 13012, 13016",Los Angeles,,85,623bf9c42267bf2868732267,"{'tuesday': '5:00\u202fPM\u2009–\u200912:00\u202fAM', 'monday': 'Closed', 'sunday': '5:00\u202fPM\u2009–\u200912:00\u202fAM', 'friday': '7:00\u202fPM\u2009–\u20092:00\u202fAM', 'saturday': '7:00\u202fPM\u2009–\u20092:00\u202fAM', 'wednesday': '5:00\u202fPM\u2009–\u200912:00\u202fAM', 'thursday': '5:00\u202fPM\u2009–\u200912:00\u202fAM'}",https://www.instagram.com/terraceinla/,False,2025-05-11 23:59:53.027192+00:00,34.1811637,-118.3088073,ChIJ0YwoW5SVwoAR_njzNiWF2M0,,,4.3,{},CA,"A Dining and Drinking, Lounge, and more in downtown LA.",,"restaurant, bar, food, point_of_interest, establishment",https://terracerestaurantandlounge.com/
Arena Night Club,"3319 Wilshire Blvd, Los Angeles, CA 90010, USA","Night Club, Gay Bar","10032, 13011",Los Angeles,,0,5a9ba29a1987ec4dbd4759b0,,,False,,34.0620233,-118.2948845,ChIJ0eCoaXzHwoARjmGpSLjqhDg,,,3.1,{},CA,"Lively nightclub & lounge offering hip-hop & R&B nights, bottle service & karaoke rooms.",,"night_club, point_of_interest, establishment",
The New Jalisco Bar,"245 Main St, Los Angeles, CA 90012, USA","Gay Bar, Wine Bar, Latin American Restaurant","13025, 13011, 13297",Los Angeles,,445,4c36d1c80a71c9b654d03dc9,"{'tuesday': '9:00\u202fPM\u2009–\u20092:00\u202fAM', 'monday': '9:00\u202fPM\u2009–\u20092:00\u202fAM', 'sunday': '4:00\u202fPM\u2009–\u20092:00\u202fAM', 'friday': '9:00\u202fPM\u2009–\u20092:00\u202fAM', 'saturday': '9:00\u202fPM\u2009–\u20092:00\u202fAM', 'wednesday': '9:00\u202fPM\u2009–\u20092:00\u202fAM', 'thursday': '9:00\u202fPM\u2009–\u20092:00\u202fAM'}",,False,2025-05-11 23:49:57.584470+00:00,34.0502685,-118.2454215,ChIJ0eVabUnGwoARp-JU3rlMD8s,,1,3.8,{},CA,"A Gay Bar, Wine Bar, and more in downtown LA.",Super cheap Tecates and tequila shots are this dive’s specialty but the party really begins at 10:30 p.m. nightly when LA’s best Latinx drag queens hit the stage. | Best micheladas in town! The employees are the best! Everything about the new jalisco is the bomb! | What's love got to do with it...,"night_club, bar, point_of_interest, establishment",
Justice Urban Tavern,"120 S Los Angeles St, Los Angeles, CA 90012, USA","Bar, Gastropub, New American Restaurant","13057, 13314, 13003",Los Angeles,,456,5277ebd911d2946ff59e0605,"{'tuesday': '6:00\u2009–\u200911:00\u202fAM, 11:30\u202fAM\u2009–\u20092:00\u202fPM, 5:00\u2009–\u200910:00\u202fPM', 'monday': '6:00\u2009–\u200911:00\u202fAM, 11:30\u202fAM\u2009–\u20092:00\u202fPM, 5:00\u2009–\u200910:00\u202fPM', 'sunday': '6:00\u2009–\u200911:00\u202fAM, 11:30\u202fAM\u2009–\u20092:00\u202fPM, 5:00\u2009–\u200910:00\u202fPM', 'friday': '6:00\u2009–\u200911:00\u202fAM, 11:30\u202fAM\u2009–\u20092:00\u202fPM, 5:00\u2009–\u200910:00\u202fPM', 'saturday': '6:00\u2009–\u200911:00\u202fAM, 11:30\u202fAM\u2009–\u20092:00\u202fPM, 5:00\u2009–\u200910:00\u202fPM', 'wednesday': '6:00\u2009–\u200911:00\u202fAM, 11:30\u202fAM\u2009–\u20092:00\u202fPM, 5:00\u2009–\u200910:00\u202fPM', 'thursday': '6:00\u2009–\u200911:00\u202fAM, 11:30\u202fAM\u2009–\u20092:00\u202fPM, 5:00\u2009–\u200910:00\u202fPM'}",,False,2025-05-11 23:50:03.571359+00:00,34.050996,-118.2424459,ChIJ1-pP9EjGwoARJ96IwETSTDE,,2,4,{},CA,Smart gastropub teaming locavore chow with craft beers & creative cocktails in a bright setting.,"Kool ambiance in Little Tokyo outdoor seating and a low key lounge spot. You can get your groove on or relax & enjoy the music & vibes. | So not like Lil Tokyo, southern music and 14 or so taps, Happy Hour from 3-7pm, but open for breakfast at 6am! Whhhhaaaa? | Wait staff need to get educated on craft beer since this is a restaurant specialty; went during happy hour with a group of 8 & several questions about the differences among beers went unanswered.","bar, restaurant, food, point_of_interest, establishment",
La Cita Bar,"336 S Hill St, Los Angeles, CA 90013, USA","Night Club, Dive Bar","10032, 13010",Los Angeles,,767,49bac961f964a520a9531fe3,"{'tuesday': '11:00\u202fAM\u2009–\u20092:00\u202fAM', 'monday': '11:00\u202fAM\u2009–\u20092:00\u202fAM', 'sunday': '10:00\u202fAM\u2009–\u20092:00\u202fAM', 'friday': '11:00\u202fAM\u2009–\u20092:00\u202fAM', 'saturday': '10:00\u202fAM\u2009–\u20092:00\u202fAM', 'wednesday': '11:00\u202fAM\u2009–\u20092:00\u202fAM', 'thursday': '11:00\u202fAM\u2009–\u20092:00\u202fAM'}",https://www.instagram.com/lacitabar/,False,2025-05-11 23:49:25.303499+00:00,34.05077199999999,-118.2497017,ChIJ10BYf0vGwoARdzJAvD5BjaY,,1,4.1,{},CA,"This traditional Latin dance club opens the floor to a young, hip crowd for DJ-driven parties.","Love this place for dancing! Music & energy 👌. There's also a chill patio outside with Downtown high rises around you. Saturday night got crowded but was a blast | There's a party here almost every day. Our favorites are Mustache Mondays and special Thursday events like Soundscape. | This place is bomb. Cool, chill vibe. Go to the back yard bar, one of the bartenders has a specialty called Tecaterita- a marg w tecate. Sounds weird but bro knows wussup, its the best!!","bar, night_club, point_of_interest, establishment",http://www.lacitabar.com/
Molly Malone's Irish Pub,"575 S Fairfax Ave, Los Angeles, CA 90036, USA","Pub, Pub",13018,Los Angeles,,384,41706480f964a520a81d1fe3,"{'tuesday': '6:00\u202fPM\u2009–\u20092:00\u202fAM', 'monday': '6:00\u202fPM\u2009–\u20092:00\u202fAM', 'sunday': '6:00\u202fPM\u2009–\u20092:00\u202fAM', 'friday': '11:00\u202fAM\u2009–\u20092:00\u202fAM', 'saturday': '6:00\u202fPM\u2009–\u20092:00\u202fAM', 'wednesday': '6:00\u202fPM\u2009–\u20092:00\u202fAM', 'thursday': '11:00\u202fAM\u2009–\u20092:00\u202fAM'}",https://www.instagram.com/mollymalonesla,False,2025-05-11 23:45:07.841306+00:00,34.065275,-118.3616833,ChIJ12CLlzu5woARmzIXICPof0A,,1,4.3,{},CA,"Well-known haunt with a homey vibe offering draft brews, pub grub & regular live music.","Flogging Molly got their start here. You could find them here every Monday night. The band got the name because ""every Monday we felt like we were flogging the place to death"" birthing their name. | Very nice! Darts. The bar & stage area are separate, which is nice if you want to chat without it being loud. Drink prices were around $8. Food is bomb! | Ernesto and Sasha are the greats bartenders and people in the universe!If you don't tip them well , you are a life ruiner! PS check out SO&SO 8-4-10 here reverbnation.com/whoissoandso","bar, restaurant, food, point_of_interest, establishment",http://www.mollymalonesla.com/
Escala K-town,"3451 W 6th St, Los Angeles, CA 90020, USA","Pub, South American Restaurant","13018, 13343",Los Angeles,,0,53210fed498e6416b2cc7a2b,"{'tuesday': '11:30\u202fAM\u2009–\u20091:00\u202fAM', 'monday': '11:30\u202fAM\u2009–\u20091:00\u202fAM', 'sunday': '11:30\u202fAM\u2009–\u20091:00\u202fAM', 'friday': '11:30\u202fAM\u2009–\u20092:00\u202fAM', 'saturday': '11:30\u202fAM\u2009–\u20092:00\u202fAM', 'wednesday': '11:30\u202fAM\u2009–\u20091:00\u202fAM', 'thursday': '11:30\u202fAM\u2009–\u20092:00\u202fAM'}",https://www.instagram.com/escalaktown,False,,34.0637139,-118.2968083,ChIJ17qBO33HwoARmLBk4_VBO-0,,2,4.3,{},CA,Contemporary bar & grill with colorful decor serving Latin dishes plus craft beers on tap.,"Delicious and affordable Colombian cuisine.  The empanadas are absolutely to die for!!!  Delicious!  Great atmosphere and vibe in the restaurant as well, very good for groups. | Must try the La Madrina. As gorgeous as it is tasty: Pisco Portón, passion fruit, mora shrub, lemon, vanilla, egg white and Angostura bitters. | The happy hour is the best thing here! The street corn, and the loaded yucca fries, very highly recommended! If AL is working here serving, the only black guy here, lol. You want him as your server.","bar, restaurant, food, point_of_interest, establishment",http://www.escalaktown.com/
Cocktails Dai Ichi Club,"4330 W Century Blvd, Inglewood, CA 90304, USA",Travel and Transportation,19000,Los Angeles,,1828,53440c21498e81570691e152,,,False,2025-05-11 23:54:51.594059+00:00,33.9452962,-118.3517064,ChIJ1f0YzPa2woARFZIK2SQ5j8g,,,,{},CA,A Travel and Transportation in downtown LA.,,"bar, point_of_interest, establishment",
